<?xml version="1.0" encoding="UTF-8"?>
<curriculum xmlns="http://herald.seu.edu.cn/ws/curriculum"
    xmlns:xsi="http://www.w3.org/2001/XMLSchema-instance"
    xsi:schemaLocation="http://herlad.seu.edu.cn/ws/curriculum curriculum.xsd"
    cardNumber="213100434"
    term="12-13-3">
    <courses>
        <course>
            <name>IT新技术讲座</name>
            <lecturer></lecturer>
            <credit>0.5</credit>
            <week from="1" to="16"/>
        </course>
        <course>
            <name>Web技术及其应用</name>
            <lecturer>Xiannong Meng</lecturer>
            <credit>2</credit>
            <week from="14" to="17"/>
        </course>
        <course>
            <name>XML技术</name>
            <lecturer>王伟</lecturer>
            <credit>2</credit>
            <week from="1" to="8"/>
        </course>
        <course>
            <name>XML技术</name>
            <lecturer>王伟</lecturer>
            <credit>2</credit>
            <week from="1" to="8"/>
        </course>
    </courses>
    <timeTable>
        <schedule day="MON">
            <attendance courseName="XML技术" place="九龙湖教四-303">
                <period from="1" to="4"/>
            </attendance>
            <attendance courseName="IT新技术讲座" place="九龙湖教八-401">
                <period from="6" to="7"/>
            </attendance>
        </schedule>
        <schedule day="TUE">
            <attendance courseName="Web技术及其应用" place="九龙湖教四-303" strategy="ODD">
                <period from="1" to="4"/>
            </attendance>
            <attendance courseName="IT新技术讲座" place="九龙湖教八-401">
                <period from="6" to="7"/>
            </attendance>
            <attendance courseName="XML技术" place="九龙湖教八-401">
                <period from="8" to="9"/>
            </attendance>
        </schedule>
    </timeTable>
</curriculum>